{
  "$schema": "../schemas/outcome-vectors.schema.json",
  "$comment": "Generated by node contract/tools/generate.mjs. Edit contract/tools, not these files.",
  "family": "outcome",
  "contract": 3,
  "section": "5.6",
  "reference": "tools/outcome.mjs",
  "notes": [
    "reduce: the input holds only the fields the reducer reads; a key that is absent is absent from the reply. Feed the object to the reducer exactly as it is.",
    "records: kind \"record\" is reduced from { ...value.result, state: value.state, outcome: value.outcome ?? value.result?.outcome }, where result is null until the record is finished; kind \"summary\" is reduced from the summary itself. Decode value with the decoder used for op records and summaries in production.",
    "A stated outcome this version does not know reduces to unknown; it is never passed through."
  ],
  "groups": {
    "reduce": [
      {
        "name": "explicit-succeeded-beats-failed",
        "purpose": "A stated outcome is read before anything else, even when the other fields would reduce to something different.",
        "consumers": [
          "agent",
          "mac",
          "desktop",
          "android"
        ],
        "tags": [
          "finding:c5"
        ],
        "input": {
          "outcome": "succeeded",
          "ok": false,
          "action": "failed",
          "reasonCode": "apply-failed"
        },
        "expect": {
          "outcome": "succeeded"
        }
      },
      {
        "name": "explicit-unknown-value",
        "purpose": "An outcome this version does not know is not passed through and not ignored in favour of the action: it is unknown.",
        "consumers": [
          "agent",
          "mac",
          "desktop",
          "android"
        ],
        "tags": [
          "finding:c5"
        ],
        "input": {
          "outcome": "partial",
          "ok": true,
          "action": "updated",
          "reasonCode": null
        },
        "expect": {
          "outcome": "unknown"
        }
      },
      {
        "name": "state-queued",
        "purpose": "Queued work is pending: the agent still owns it, and the client polls.",
        "consumers": [
          "agent",
          "mac",
          "desktop",
          "android"
        ],
        "tags": [
          "finding:c5"
        ],
        "input": {
          "state": "queued"
        },
        "expect": {
          "outcome": "pending"
        }
      },
      {
        "name": "state-running-with-updated",
        "purpose": "A running state beats an action, so a record that already names where it is heading is still pending.",
        "consumers": [
          "agent",
          "mac",
          "desktop",
          "android"
        ],
        "tags": [
          "finding:c5"
        ],
        "input": {
          "state": "running",
          "ok": true,
          "action": "updated",
          "reasonCode": null
        },
        "expect": {
          "outcome": "pending"
        }
      },
      {
        "name": "accepted",
        "purpose": "accepted is the answer to --detach: the work is running and the client polls op ID --wait 20.",
        "consumers": [
          "agent",
          "mac",
          "desktop",
          "android"
        ],
        "tags": [
          "finding:c5"
        ],
        "input": {
          "ok": true,
          "action": "accepted",
          "reasonCode": null
        },
        "expect": {
          "outcome": "pending"
        }
      },
      {
        "name": "accepted-timed-out",
        "purpose": "A 3.0.x shape: accepted with a code beside it. The action decides, and the work is still the agent's.",
        "consumers": [
          "agent",
          "mac",
          "desktop",
          "android"
        ],
        "tags": [
          "finding:c5",
          "agent-3.0"
        ],
        "input": {
          "ok": true,
          "action": "accepted",
          "reasonCode": "timed-out"
        },
        "expect": {
          "outcome": "pending"
        }
      },
      {
        "name": "already-running",
        "purpose": "A replay of an id whose work is still running, as 3.1.0 answers it. The client follows it exactly as it follows accepted.",
        "consumers": [
          "agent",
          "mac",
          "desktop",
          "android"
        ],
        "tags": [
          "finding:c5",
          "finding:c2"
        ],
        "input": {
          "ok": true,
          "action": "already-running",
          "reasonCode": "already-running"
        },
        "expect": {
          "outcome": "pending"
        }
      },
      {
        "name": "action-queued",
        "purpose": "The answer to --when-idle: a record waiting for an idle cycle is pending.",
        "consumers": [
          "agent",
          "mac",
          "desktop",
          "android"
        ],
        "tags": [
          "finding:c5"
        ],
        "input": {
          "ok": true,
          "action": "queued",
          "reasonCode": null
        },
        "expect": {
          "outcome": "pending"
        }
      },
      {
        "name": "action-rebooting",
        "purpose": "A reboot was scheduled; only a later reading of the record says whether it happened.",
        "consumers": [
          "agent",
          "mac",
          "desktop",
          "android"
        ],
        "tags": [
          "finding:c5"
        ],
        "input": {
          "ok": true,
          "action": "rebooting",
          "reasonCode": null
        },
        "expect": {
          "outcome": "pending"
        }
      },
      {
        "name": "action-sleeping",
        "purpose": "A suspend was accepted; only recovery ever writes slept, so until then it is pending.",
        "consumers": [
          "agent",
          "mac",
          "desktop",
          "android"
        ],
        "tags": [
          "finding:c5"
        ],
        "input": {
          "ok": true,
          "action": "sleeping",
          "reasonCode": null
        },
        "expect": {
          "outcome": "pending"
        }
      },
      {
        "name": "success-updated",
        "purpose": "updated is one of the success actions: the requested state holds.",
        "consumers": [
          "agent",
          "mac",
          "desktop",
          "android"
        ],
        "tags": [
          "finding:c5"
        ],
        "input": {
          "ok": true,
          "action": "updated",
          "reasonCode": null
        },
        "expect": {
          "outcome": "succeeded"
        }
      },
      {
        "name": "success-restarted",
        "purpose": "restarted is one of the success actions: the requested state holds.",
        "consumers": [
          "agent",
          "mac",
          "desktop",
          "android"
        ],
        "tags": [
          "finding:c5"
        ],
        "input": {
          "ok": true,
          "action": "restarted",
          "reasonCode": null
        },
        "expect": {
          "outcome": "succeeded"
        }
      },
      {
        "name": "success-ran",
        "purpose": "ran is one of the success actions: the requested state holds.",
        "consumers": [
          "agent",
          "mac",
          "desktop",
          "android"
        ],
        "tags": [
          "finding:c5"
        ],
        "input": {
          "ok": true,
          "action": "ran",
          "reasonCode": null
        },
        "expect": {
          "outcome": "succeeded"
        }
      },
      {
        "name": "success-rebooted",
        "purpose": "rebooted is one of the success actions: the requested state holds.",
        "consumers": [
          "agent",
          "mac",
          "desktop",
          "android"
        ],
        "tags": [
          "finding:c5"
        ],
        "input": {
          "ok": true,
          "action": "rebooted",
          "reasonCode": null
        },
        "expect": {
          "outcome": "succeeded"
        }
      },
      {
        "name": "success-slept",
        "purpose": "slept is one of the success actions: the requested state holds.",
        "consumers": [
          "agent",
          "mac",
          "desktop",
          "android"
        ],
        "tags": [
          "finding:c5"
        ],
        "input": {
          "ok": true,
          "action": "slept",
          "reasonCode": null
        },
        "expect": {
          "outcome": "succeeded"
        }
      },
      {
        "name": "success-armed",
        "purpose": "armed is one of the success actions: the requested state holds.",
        "consumers": [
          "agent",
          "mac",
          "desktop",
          "android"
        ],
        "tags": [
          "finding:c5"
        ],
        "input": {
          "ok": true,
          "action": "armed",
          "reasonCode": null
        },
        "expect": {
          "outcome": "succeeded"
        }
      },
      {
        "name": "success-installed",
        "purpose": "installed is one of the success actions: the requested state holds.",
        "consumers": [
          "agent",
          "mac",
          "desktop",
          "android"
        ],
        "tags": [
          "finding:c5"
        ],
        "input": {
          "ok": true,
          "action": "installed",
          "reasonCode": null
        },
        "expect": {
          "outcome": "succeeded"
        }
      },
      {
        "name": "success-cycled",
        "purpose": "cycled is one of the success actions: the requested state holds.",
        "consumers": [
          "agent",
          "mac",
          "desktop",
          "android"
        ],
        "tags": [
          "finding:c5"
        ],
        "input": {
          "ok": true,
          "action": "cycled",
          "reasonCode": null
        },
        "expect": {
          "outcome": "succeeded"
        }
      },
      {
        "name": "success-checked",